### ISSUE TITLE
flow not captured

### ISSUE THREAD

**Issue by fadycopty** [skydive-project/skydive#1961]
I am working on setting up a deployment test for a "fake ip" communication.

I set up an interface on my host eth0 (chose 3.3.3.3 as the "fake-malicous-ip" for testing purpose):
`sudo ifconfig eth0:1 3.3.3.3 netmask 255.255.255.255 up`

Then setup a python server listening to local ( same as 9.148.244.87), and run 
`
curl --interface 3.3.3.3 127.0.0.1:8000
curl --interface 3.3.3.3 9.148.244.87:8000 
`
This results in the server showing communication from 3.3.3.3
`3.3.3.3 - - [20/Aug/2019 15:19:17] "GET / HTTP/1.1" 200 -`

But skydive is unable to capture the flow from 3.3.3.3.

SkyDive is able to see 3.3.3.3 in the route table.

Also tried the above from python-client instead of curl, and tried to set a server listen to 3.3.3.3 - but still skydive did not catch it.

**Comment by hunchback** [comment]
@fadycopty - can you share output of `tcpdump -lnX -e -i any host 3.3.3.3`

**Comment by safchain** [comment]
@fadycopty Hi, few questions

- how did you deploy Skydive
- how did you start the capture

Thanks

**Comment by fadycopty** [comment]
deployed skydive agent:
`sudo docker run --privileged --pid=host --net=host -p 8081:8081   -e SKYDIVE_ANALYZERS=localhost:8082   -v /var/run/docker.sock:/var/run/docker.sock skydive/skydive agent`
deployed analyzer:
`sudo docker run -p 8082:8082 skydive/skydive analyzer`

on skydive UI, found the eth0 and started capture

**Comment by fadycopty** [comment]
tcp dump:
`~$ sudo tcpdump -lnX -e -i any host 3.3.3.3
tcpdump: verbose output suppressed, use -v or -vv for full protocol decode
listening on any, link-type LINUX_SLL (Linux cooked), capture size 262144 bytes
15:01:29.875315  In 00:00:00:00:00:00 ethertype IPv4 (0x0800), length 76: 3.3.3.3.38659 > 127.0.0.1.8000: Flags [S], seq 1231561789, win 43690, options [mss 65495,sackOK,TS val 2334777013 ecr 0,nop,wscale 7], length 0
	0x0000:  4500 003c fa88 4000 4006 bb2c 0303 0303  E..<..@.@..,....
	0x0010:  7f00 0001 9703 1f40 4968 243d 0000 0000  .......@Ih$=....
	0x0020:  a002 aaaa 8535 0000 0204 ffd7 0402 080a  .....5..........
	0x0030:  8b29 deb5 0000 0000 0103 0307            .)..........
15:01:29.875340  In 00:00:00:00:00:00 ethertype IPv4 (0x0800), length 76: 127.0.0.1.8000 > 3.3.3.3.38659: Flags [S.], seq 4239204751, ack 1231561790, win 43690, options [mss 65495,sackOK,TS val 2334777013 ecr 2334777013,nop,wscale 7], length 0
	0x0000:  4500 003c 0000 4000 4006 b5b5 7f00 0001  E..<..@.@.......
	0x0010:  0303 0303 1f40 9703 fcad 218f 4968 243e  .....@....!.Ih$>
	0x0020:  a012 aaaa 8535 0000 0204 ffd7 0402 080a  .....5..........
	0x0030:  8b29 deb5 8b29 deb5 0103 0307            .)...)......
15:01:29.875356  In 00:00:00:00:00:00 ethertype IPv4 (0x0800), length 68: 3.3.3.3.38659 > 127.0.0.1.8000: Flags [.], ack 1, win 342, options [nop,nop,TS val 2334777013 ecr 2334777013], length 0
	0x0000:  4500 0034 fa89 4000 4006 bb33 0303 0303  E..4..@.@..3....
	0x0010:  7f00 0001 9703 1f40 4968 243e fcad 2190  .......@Ih$>..!.
	0x0020:  8010 0156 852d 0000 0101 080a 8b29 deb5  ...V.-.......)..
	0x0030:  8b29 deb5                                .)..
15:01:29.875452  In 00:00:00:00:00:00 ethertype IPv4 (0x0800), length 146: 3.3.3.3.38659 > 127.0.0.1.8000: Flags [P.], seq 1:79, ack 1, win 342, options [nop,nop,TS val 2334777013 ecr 2334777013], length 78
	0x0000:  4500 0082 fa8a 4000 4006 bae4 0303 0303  E.....@.@.......
	0x0010:  7f00 0001 9703 1f40 4968 243e fcad 2190  .......@Ih$>..!.
	0x0020:  8018 0156 857b 0000 0101 080a 8b29 deb5  ...V.{.......)..
	0x0030:  8b29 deb5 4745 5420 2f20 4854 5450 2f31  .)..GET./.HTTP/1
	0x0040:  2e31 0d0a 486f 7374 3a20 3132 372e 302e  .1..Host:.127.0.
	0x0050:  302e 313a 3830 3030 0d0a 5573 6572 2d41  0.1:8000..User-A
	0x0060:  6765 6e74 3a20 6375 726c 2f37 2e34 372e  gent:.curl/7.47.
	0x0070:  300d 0a41 6363 6570 743a 202a 2f2a 0d0a  0..Accept:.*/*..
	0x0080:  0d0a                                     ..
15:01:29.876413  In 00:00:00:00:00:00 ethertype IPv4 (0x0800), length 222: 127.0.0.1.8000 > 3.3.3.3.38659: Flags [P.], seq 1:155, ack 79, win 342, options [nop,nop,TS val 2334777013 ecr 2334777013], length 154
	0x0000:  4500 00ce ff26 4000 4006 b5fc 7f00 0001  E....&@.@.......
	0x0010:  0303 0303 1f40 9703 fcad 2190 4968 248c  .....@....!.Ih$.
	0x0020:  8018 0156 85c7 0000 0101 080a 8b29 deb5  ...V.........)..
	0x0030:  8b29 deb5 4854 5450 2f31 2e30 2032 3030  .)..HTTP/1.0.200
	0x0040:  204f 4b0d 0a53 6572 7665 723a 2053 696d  .OK..Server:.Sim
	0x0050:  706c 6548 5454 502f 302e 3620 5079 7468  pleHTTP/0.6.Pyth
	0x0060:  6f6e 2f33 2e35 2e32 0d0a 4461 7465 3a20  on/3.5.2..Date:.
	0x0070:  5468 752c 2032 3220 4175 6720 3230 3139  Thu,.22.Aug.2019
	0x0080:  2031 323a 3031 3a32 3920 474d 540d 0a43  .12:01:29.GMT..C
	0x0090:  6f6e 7465 6e74 2d74 7970 653a 2074 6578  ontent-type:.tex
	0x00a0:  742f 6874 6d6c 3b20 6368 6172 7365 743d  t/html;.charset=
	0x00b0:  7574 662d 380d 0a43 6f6e 7465 6e74 2d4c  utf-8..Content-L
	0x00c0:  656e 6774 683a 2036 3938 0d0a 0d0a       ength:.698....
15:01:29.876432  In 00:00:00:00:00:00 ethertype IPv4 (0x0800), length 68: 3.3.3.3.38659 > 127.0.0.1.8000: Flags [.], ack 155, win 350, options [nop,nop,TS val 2334777013 ecr 2334777013], length 0
	0x0000:  4500 0034 fa8b 4000 4006 bb31 0303 0303  E..4..@.@..1....
	0x0010:  7f00 0001 9703 1f40 4968 248c fcad 222a  .......@Ih$..."*
	0x0020:  8010 015e 852d 0000 0101 080a 8b29 deb5  ...^.-.......)..
	0x0030:  8b29 deb5                                .)..
15:01:29.876476  In 00:00:00:00:00:00 ethertype IPv4 (0x0800), length 766: 127.0.0.1.8000 > 3.3.3.3.38659: Flags [P.], seq 155:853, ack 79, win 342, options [nop,nop,TS val 2334777013 ecr 2334777013], length 698
	0x0000:  4500 02ee ff27 4000 4006 b3db 7f00 0001  E....'@.@.......
	0x0010:  0303 0303 1f40 9703 fcad 222a 4968 248c  .....@...."*Ih$.
	0x0020:  8018 0156 87e7 0000 0101 080a 8b29 deb5  ...V.........)..
	0x0030:  8b29 deb5 3c21 444f 4354 5950 4520 4854  .)..<!DOCTYPE.HT
	0x0040:  4d4c 2050 5542 4c49 4320 222d 2f2f 5733  ML.PUBLIC."-//W3
	0x0050:  432f 2f44 5444 2048 544d 4c20 342e 3031  C//DTD.HTML.4.01
	0x0060:  2f2f 454e 2220 2268 7474 703a 2f2f 7777  //EN"."http://ww
	0x0070:  772e 7733 2e6f 7267 2f54 522f 6874 6d6c  w.w3.org/TR/html
	0x0080:  342f 7374 7269 6374 2e64 7464 223e 0a3c  4/strict.dtd">.<
	0x0090:  6874 6d6c 3e0a 3c68 6561 643e 0a3c 6d65  html>.<head>.<me
	0x00a0:  7461 2068 7474 702d 6571 7569 763d 2243  ta.http-equiv="C
	0x00b0:  6f6e 7465 6e74 2d54 7970 6522 2063 6f6e  ontent-Type".con
	0x00c0:  7465 6e74 3d22 7465 7874 2f68 746d 6c3b  tent="text/html;
	0x00d0:  2063 6861 7273 6574 3d75 7466 2d38 223e  .charset=utf-8">
	0x00e0:  0a3c 7469 746c 653e 4469 7265 6374 6f72  .<title>Director
	0x00f0:  7920 6c69 7374 696e 6720 666f 7220 2f3c  y.listing.for./<
	0x0100:  2f74 6974 6c65 3e0a 3c2f 6865 6164 3e0a  /title>.</head>.
	0x0110:  3c62 6f64 793e 0a3c 6831 3e44 6972 6563  <body>.<h1>Direc
	0x0120:  746f 7279 206c 6973 7469 6e67 2066 6f72  tory.listing.for
	0x0130:  202f 3c2f 6831 3e0a 3c68 723e 0a3c 756c  ./</h1>.<hr>.<ul
	0x0140:  3e0a 3c6c 693e 3c61 2068 7265 663d 222e  >.<li><a.href=".
	0x0150:  6261 7368 5f68 6973 746f 7279 223e 2e62  bash_history">.b
	0x0160:  6173 685f 6869 7374 6f72 793c 2f61 3e3c  ash_history</a><
	0x0170:  2f6c 693e 0a3c 6c69 3e3c 6120 6872 6566  /li>.<li><a.href
	0x0180:  3d22 2e62 6173 685f 6c6f 676f 7574 223e  =".bash_logout">
	0x0190:  2e62 6173 685f 6c6f 676f 7574 3c2f 613e  .bash_logout</a>
	0x01a0:  3c2f 6c69 3e0a 3c6c 693e 3c61 2068 7265  </li>.<li><a.hre
	0x01b0:  663d 222e 6261 7368 7263 223e 2e62 6173  f=".bashrc">.bas
	0x01c0:  6872 633c 2f61 3e3c 2f6c 693e 0a3c 6c69  hrc</a></li>.<li
	0x01d0:  3e3c 6120 6872 6566 3d22 2e63 6163 6865  ><a.href=".cache
	0x01e0:  2f22 3e2e 6361 6368 652f 3c2f 613e 3c2f  /">.cache/</a></
	0x01f0:  6c69 3e0a 3c6c 693e 3c61 2068 7265 663d  li>.<li><a.href=
	0x0200:  222e 656d 6163 732e 642f 223e 2e65 6d61  ".emacs.d/">.ema
	0x0210:  6373 2e64 2f3c 2f61 3e3c 2f6c 693e 0a3c  cs.d/</a></li>.<
	0x0220:  6c69 3e3c 6120 6872 6566 3d22 2e6b 7562  li><a.href=".kub
	0x0230:  652f 223e 2e6b 7562 652f 3c2f 613e 3c2f  e/">.kube/</a></
	0x0240:  6c69 3e0a 3c6c 693e 3c61 2068 7265 663d  li>.<li><a.href=
	0x0250:  222e 7072 6f66 696c 6522 3e2e 7072 6f66  ".profile">.prof
	0x0260:  696c 653c 2f61 3e3c 2f6c 693e 0a3c 6c69  ile</a></li>.<li
	0x0270:  3e3c 6120 6872 6566 3d22 2e70 7974 686f  ><a.href=".pytho
	0x0280:  6e5f 6869 7374 6f72 7922 3e2e 7079 7468  n_history">.pyth
	0x0290:  6f6e 5f68 6973 746f 7279 3c2f 613e 3c2f  on_history</a></
	0x02a0:  6c69 3e0a 3c6c 693e 3c61 2068 7265 663d  li>.<li><a.href=
	0x02b0:  222e 5861 7574 686f 7269 7479 223e 2e58  ".Xauthority">.X
	0x02c0:  6175 7468 6f72 6974 793c 2f61 3e3c 2f6c  authority</a></l
	0x02d0:  693e 0a3c 2f75 6c3e 0a3c 6872 3e0a 3c2f  i>.</ul>.<hr>.</
	0x02e0:  626f 6479 3e0a 3c2f 6874 6d6c 3e0a       body>.</html>.
15:01:29.876488  In 00:00:00:00:00:00 ethertype IPv4 (0x0800), length 68: 3.3.3.3.38659 > 127.0.0.1.8000: Flags [.], ack 853, win 361, options [nop,nop,TS val 2334777013 ecr 2334777013], length 0
	0x0000:  4500 0034 fa8c 4000 4006 bb30 0303 0303  E..4..@.@..0....
	0x0010:  7f00 0001 9703 1f40 4968 248c fcad 24e4  .......@Ih$...$.
	0x0020:  8010 0169 852d 0000 0101 080a 8b29 deb5  ...i.-.......)..
	0x0030:  8b29 deb5                                .)..
15:01:29.876848  In 00:00:00:00:00:00 ethertype IPv4 (0x0800), length 68: 3.3.3.3.38659 > 127.0.0.1.8000: Flags [F.], seq 79, ack 854, win 361, options [nop,nop,TS val 2334777013 ecr 2334777013], length 0
	0x0000:  4500 0034 fa8d 4000 4006 bb2f 0303 0303  E..4..@.@../....
	0x0010:  7f00 0001 9703 1f40 4968 248c fcad 24e5  .......@Ih$...$.
	0x0020:  8011 0169 852d 0000 0101 080a 8b29 deb5  ...i.-.......)..
	0x0030:  8b29 deb5                                .)..
15:01:29.876859  In 00:00:00:00:00:00 ethertype IPv4 (0x0800), length 68: 127.0.0.1.8000 > 3.3.3.3.38659: Flags [.], ack 80, win 342, options [nop,nop,TS val 2334777013 ecr 2334777013], length 0
	0x0000:  4500 0034 ff29 4000 4006 b693 7f00 0001  E..4.)@.@.......
	0x0010:  0303 0303 1f40 9703 fcad 24e5 4968 248d  .....@....$.Ih$.
	0x0020:  8010 0156 852d 0000 0101 080a 8b29 deb5  ...V.-.......)..
	0x0030:  8b29 deb5                                .)..
`

**Comment by hunchback** [comment]
@fadycopty - can you provide a screenshot of your capture definition / topology view?

**Comment by hunchback** [comment]
@fadycopty - also I notice that the mac address is 00:00:00:00:00:00 - I am don't understand why we are not getting a real mac address here

**Comment by safchain** [comment]
@fadycopty if the curl if made from the localhost I guess the packet will never be reported by the kernel you can confirm this by capturing with tcpdump only the interface with 3.3.3.3 and not with `-i any` which captures the loopback interface.

**Comment by fadycopty** [comment]
I have tested it with
`sudo tcpdump -lnX -e host 3.3.3.3`
and tcpdump did not capture the trafic
